Event,Date,Time,Address,Description
Develop a Successful Artificial Intelligence Startup Business,Online,Online,"BangaloreVirtual WorkshopBangalore, KA",
Develop a Successful Virtual Reality Tech Startup Business Today!,Online,Online,"HyderabadVirtual WorkshopHyderabad, Telangana",Learn to Develop a Successful  Virtual Reality VR Startup Business Today!
How To Read Faster & Comprehend More-Kolkata,Online,Online,"(ONLINE EVENT)Kolkata, West Bengal 700105",This is an online event. 
Develop a Successful Virtual Reality Tech Startup Business Today!,Online,Online,"BangaloreVirtual WorkshopBangalore, KA",Learn to Develop a Successful  Virtual Reality VR Startup Business Today!
Develop a Successful Virtual Reality Tech Startup Business Today!,Online,Online,"ChennaiVirtual WorkshopChennai, TN",Learn to Develop a Successful  Virtual Reality VR Startup Business Today!
CORE TRAINING,"Fri, Jul 8, 2022, 7:00 PM –","Sat, Jul 9, 2022, 10:00 PM IST","Rourkela Mega Recreational Park.Rourkela, OR 769014",N/A
Develop a Successful Artificial Intelligence Startup Business,Online,Online,"DelhiVirtual WorkshopDelhi, DL",
Develop Your Own Successful Virtual Reality Tech Startup Business Today!,Online,Online,"DelhiVirtual WorkshopDelhi, DL",Learn to Develop a Successful  Virtual Reality VR Startup Business Today!
Develop Your Own Successful Virtual Reality Tech Startup Business Today!,Online,Online,"BombayVirtual WorkshopBombay, MH",Learn to Develop a Successful  Virtual Reality VR Startup Business Today!
SAFe 5.1 Advanced Scrum Master Certification (In Person),"Fri, Jul 8, 2022, 9:00 AM –","Sat, Jul 9, 2022, 5:00 PM IST","BengaluruTBDBengaluru, KA 560008",SAFe® Advanced Scrum Master answers the questions:
Overcome Challenges with Getting Hired and Get a Fresh Start in 5 Days,Online,Online,"Samex LLC - Online Mentoring Classroom455, Anna SalaiChennai, TN 600018","There's a saying ""If you're not making mistakes, you're not doing anything."""
Develop a Successful Virtual Reality Tech Startup Business Today!,Online,Online,"PuneVirtual WorkshopPune, MH",Learn to Develop a Successful  Virtual Reality VR Startup Business Today!
Develop a Successful Virtual Reality Tech Startup Business Today!,Online,Online,"CalcuttaVirtual WorkshopCalcutta, WB",Learn to Develop a Successful  Virtual Reality VR Startup Business Today!
"Cyber Security Overview 1 Day Training in Anchorage, AK",Online,Online,"For venue details  reach us at info@mangates.comPH no: +1 469 666 9332Anchorage, AK 99501",Course Description:
Punjab - A World Of Opportunities,"Sat, Jul 2, 2022, 7:00 PM IST",,"Park Plaza LudhianaFerozepur RoadLudhiana, PB 141001", 
SAFe Agilist 5.0 Certification Classroom Training,"Sat, 2 Jul 2022, 09:30 –","Sun, 3 Jul 2022, 18:00 IST","Sayaji Hotel135/136, Mumbai-Bangalore Bypass HighwayWakadPimpri-Chinchwad, MH 411057",Why you should use #SAFe  
SAFe Agilist 5.0 Certification Classroom Training,"Sat, 2 Jul 2022, 09:30 –","Sun, 3 Jul 2022, 18:00 IST","Sayaji Hotel135/136, Mumbai-Bangalore By pass HighwayWakadPune, MH 411057",Why you should use #SAFe  
GCCI EduSkill Tech Expo,"Mon, July 11, 2022",10:00 AM – 7:00 PM IST,"Shri Ambica textile millsAshram RoadAhmedabad, GJ 380009","""GCCI cordially invites you to attend Exhibition on Education & Skill Sector"
PingPongX Delhi Seller Meetup 2022 Passport to Global Payment Solutions,"Fri, Jul 1, 2022, 10:00 AM IST",,"Radisson Blu Plaza Delhi AirportNh 8New Delhi, DL 110037","Grow Your International Business With PingPong Payment’s seamless solutions for your Marketplace, B2B Business, Freelancers payments & Website payments."
eChai Startup Demo Day in Mumbai,"Sat, July 16, 2022",10:00 AM – 1:30 PM IST,"DevXAndheri - Kurla RoadMumbai, MH 400065","** This meetup has been postponed by 1  month. It will now be held on 16th July, Saturday from 10 am to 1 pm. **"
HCMC Content Creator Meetup,"Sat, July 23, 2022",10:00 AM – 2:00 PM Indochina Time Vietnam Time,"Ho Chi Minh CityTBAHCMC, TP HCM 700000Viet Nam","If you are Content Creator or just starting your journey, then this event is perfect for you. We have awesome guest speakers that will share their success stories and methods to elevate your brand on different social platforms. "
Entrepreneur 2022,"Tue, Jul 26, 2022, 10:00 AM –","Wed, Jul 27, 2022, 6:00 PM IST","JW Marriott Hotel New Delhi AerocityAerocity, New DelhiNew Delhi, DL 110037",N/A
Connecting Ideas With Money @Lounge47: Investor Series.,"Fri, July 29, 2022",4:30 PM – 7:00 PM IST,"Lounge471st Cross RoadBengaluru, KA 560038",Bringing Investors and Entrepreneurs face-to-face
World Social Media Day - 2022,"Sat, July 30, 2022",4:00 PM – 6:00 PM IST,"LamakaanBanjara HillsHyderabad, TG 500034",Join us for the Social Media Day on June 30th at Lamakaan Hyderabad
Bangalore's Big Business Tech & Entrepreneur Professional Networking Soriee,"Mon, July 18, 2022",6:00 PM – 9:00 PM IST,"JW Marriott Hotel Bengaluru - Hotel Lobby1 Vittal Mallya Road#24Bengaluru, KA 560001",
Apparel Sourcing Week: India’s Premier Sourcing Show,"Fri, Jul 1, 2022, 10:00 AM –","Sat, Jul 2, 2022, 6:00 PM IST","Sheraton Grand Bengaluru Whitefield Hotel & Convention CenterSHERATON GRAND BENGALURU WHITEFIELD HOTEL& CONVENTION CENTER Prestige Shantiniketan Hoodi, WhitefieldBengaluru, KA 560048","A platform curated on the three pillars of opportunity, knowledge and inspiration, ASW 2022 invites sourcing specialists from India and around the world, offering them an opportunity to interact with top global garment manufacturers, hand-picked for their focus on creativity, quality, delivery commitments and compliance to social obligations."
Franchise Expo 2022 in Delhi,"Sun, July 10, 2022",9:00 AM – 5:00 PM IST,"Jaypee Siddharth - 5 Star Luxury Hotels in DelhiJaypee Siddharth - 5 Star Luxury Hotels in DelhiNew Delhi, DL 110008",Expand your Franchise Network to all India with the End to End Services with Franchisebatao.com 
Conquer Your Fear of Public Speaking - Delhi - Zoom Free Trial Class,Online,Online,"New DelhiDelhiNew Delhi, DL 110004","Overcome public speaking fear with gradual exposure, in a supportive environment. Observe a free trial to see if it's right for you. Based out of New York City for 30 years, we are now offering these classes online to an international audience. "
Conquer Your Fear of Public Speaking -Bengaluru- Virtual Free Trial Class,Online,Online,"BengaluruBengaluruBengaluru, KA 560001","Overcome public speaking fear with gradual exposure, in a supportive environment. Observe a free trial to see if it's right for you. Based out of New York City for 30 years, we are now offering these classes online to an international audience. "
Conquer Your Fear of Public Speaking -Mumbai- Virtual Free Trial Class,Online,Online,"MumbaiMumbaiMumbai, MH 400051","Overcome public speaking fear with gradual exposure, in a supportive environment. Observe a free trial to see if it's right for you. Based out of New York City for 30 years, we are now offering these classes online to an international audience. "
SOLAR PRACTICAL WORKSHOP,"Wed, Jun 29, 2022, 10:00 AM –","Fri, Jul 1, 2022, 5:00 PM IST","Paradise TowerRailway station, Paradise TowersNext to Mc Donalds, Gokhale Rd, opp. Hotel AlokThane, Thane West,, Maharashtra 400601 400601","This Three days program is designed for new/ existing Solar Entrepreneurs & working solar professionals who are looking for in-depth knowledge to complete their Solar EPC projects. The course will cover hands on training in completing techno-commercial proposals, different solar investment models, solar payback period calculation, Power purchase agreement, Levelized cost of energy and many more…"
